{
  "room_id": "room-001",
  "task_ref": "EPIC-001",
  "plan_id": "hello-world-react-dashboard",
  "created_at": "2026-03-13T03:25:02Z",
  "working_dir": "/Users/paulaan/PycharmProjects/agent-os/.agents/plans",
  "assignment": {
    "title": "Hello World React Dashboard",
    "description": "Hello World React Dashboard",
    "assigned_role": "engineer",
    "type": "epic"
  },
  "goals": {
    "definition_of_done": [
      "React app scaffolded with Vite",
      "Dashboard page renders with greeting and status cards",
      "All components render without errors"
    ],
    "acceptance_criteria": [
      "Running `npm run dev` starts the dev server",
      "Dashboard shows at least 3 status cards",
      "Page title is \"Hello World Dashboard\""
    ],
    "quality_requirements": {
      "test_coverage_min": 80,
      "lint_clean": true,
      "security_scan_pass": true
    }
  },
  "constraints": {
    "max_retries": 3,
    "timeout_seconds": 900,
    "budget_tokens_max": 500000
  },
  "status": {
    "current": "pending",
    "retries": 0,
    "started_at": null,
    "last_state_change": "2026-03-13T03:25:02Z"
  }
}
